{
  "schemaVersion": 1,
  "assetId": "arm.mire.warbrute.hands.t1.m",
  "displayName": "Warbrute Handguards Male",
  "category": "armor",
  "model": "arm_mire_warbrute_hands_t1_m.glb",
  "qc": "arm_mire_warbrute_hands_t1_m.qc.json",
  "runtime": {
    "itemKey": "starter_mire_brutish_warbrute_hands_m",
    "bodyVariant": "m",
    "skinned": true
  },
  "compatibility": {
    "bodyFamily": "mire_warbrute_m",
    "bodyVariant": "m",
    "skeletonId": "humanoid_game_v2",
    "bindPoseId": "a_pose_v2",
    "coveredRegions": [
      "arms",
      "hands"
    ]
  },
  "hashes": {
    "modelSha256": "b11e55f67d2cae48aa807264ce3469a7ee9f3c105d0ca24322d78beba281ba12",
    "qcSha256": "6e41fe682f2a63f5c010f0ea98a6a980e96d8d82ec9a49c73b5ee963536f0d9b",
    "previews": {
      "front": "c890ecac63030b6af82705407f41c5871fcabb298b9000f001870ed5658f18db"
    }
  },
  "previews": {
    "front": "reviews/roster-direct/warbrute/m/hands_front.png"
  },
  "provenance": {
    "kind": "roster_direct_promotion",
    "sourceRevision": 1,
    "sourceRunId": "dark-fantasy-character-pass-v3",
    "bypassApproval": true,
    "bypassReason": "User-authorized readable dark-fantasy material and calibrated fallback weapon iteration"
  },
  "review": {
    "reviewedBy": "codex-user-authorized-bypass",
    "reviewedAt": "2026-07-15T10:19:40.672Z",
    "reviewHash": "f08feb3b4eb51fbf1216b2165f5ef0e0d2778359b4cff175627d59ba7b45eb15"
  },
  "approvalState": "approved"
}
