{
  "schemaVersion": 1,
  "assetId": "arm.civic.battle_prelate.head.t1.f",
  "displayName": "Battle Prelate Headgear Female",
  "category": "armor",
  "model": "arm_civic_battle_prelate_head_t1_f.glb",
  "qc": "arm_civic_battle_prelate_head_t1_f.qc.json",
  "runtime": {
    "itemKey": "starter_civic_humanoid_battle_prelate_head_f",
    "bodyVariant": "f",
    "skinned": true
  },
  "compatibility": {
    "bodyFamily": "civic_battle_prelate_f",
    "bodyVariant": "f",
    "skeletonId": "humanoid_game_v2",
    "bindPoseId": "a_pose_v2",
    "coveredRegions": [
      "head"
    ]
  },
  "hashes": {
    "modelSha256": "6e8fc4225676ac514a37791a8fc35411c69cd791e47e7edc39f7f9c1406f0275",
    "qcSha256": "b8c98bcccb67ba3023afd2b13cdb181d77cc78b6c7a4cd321b34021c1b710fa9",
    "previews": {
      "front": "d0c4b361c027cc32d12d2d4bb017e55e9c07fff0f60eb62efd55e3c78d920b9d"
    }
  },
  "previews": {
    "front": "reviews/roster-direct/battle_prelate/f/head_front.png"
  },
  "provenance": {
    "kind": "roster_direct_promotion",
    "sourceRevision": 1,
    "sourceRunId": "armor-fit-final2-battle",
    "bypassApproval": true,
    "bypassReason": "User-authorized armor fit regeneration"
  },
  "review": {
    "reviewedBy": "codex-user-authorized-bypass",
    "reviewedAt": "2026-07-14T21:02:51.293Z",
    "reviewHash": "0ef166e8115aa5883870f0e92be78ca4c8f42f0cd66b79d46b18faf0a68ceeb5"
  },
  "approvalState": "approved"
}
