{
  "schemaVersion": 1,
  "assetId": "arm.civic.battle_prelate.back.t1.f",
  "displayName": "Battle Prelate Backpiece Female",
  "category": "armor",
  "model": "arm_civic_battle_prelate_back_t1_f.glb",
  "qc": "arm_civic_battle_prelate_back_t1_f.qc.json",
  "runtime": {
    "itemKey": "starter_civic_humanoid_battle_prelate_back_f",
    "bodyVariant": "f",
    "skinned": true
  },
  "compatibility": {
    "bodyFamily": "civic_battle_prelate_f",
    "bodyVariant": "f",
    "skeletonId": "humanoid_game_v2",
    "bindPoseId": "a_pose_v2",
    "coveredRegions": [
      "back"
    ]
  },
  "hashes": {
    "modelSha256": "5d9fc25a45993fe54e08d54d590ec66fe2c1d02a41792e3755a993133e4db79e",
    "qcSha256": "d6c57786c5cf660897eb0e67fdf7029d531f58505b462537a270fd376fe0e0e0",
    "previews": {
      "front": "534f45e9508dafa8f6b7af3426c2e5984d986c1e13065c7156d902aa4afc9665"
    }
  },
  "previews": {
    "front": "reviews/roster-direct/battle_prelate/f/back_front.png"
  },
  "provenance": {
    "kind": "roster_direct_promotion",
    "sourceRevision": 2,
    "sourceRunId": "dark-fantasy-character-pass-v1",
    "bypassApproval": true,
    "bypassReason": "User-authorized dark-fantasy palette and canonical hand-socket attachment iteration"
  },
  "review": {
    "reviewedBy": "codex-user-authorized-bypass",
    "reviewedAt": "2026-07-15T08:58:45.603Z",
    "reviewHash": "928c5fc75e94dff7a03605d5b25af13822b186cefc4390546c2c05f1406afcb0"
  },
  "approvalState": "approved"
}
